<?xml version="1.0" encoding="UTF-8"?>
<!--
============================================
Copyright 2022 Omega International Junior School. All Right Reserved.
Web Application is under GNU General Public License v3.0
============================================
//Author: Poh Choo Meng
-->
<?xml-stylesheet type="text/xsl" href="courselist.xsl"?>
<courses xmlns:xsi="http://www.w3.org/2001/XMLSchema-instance" xsi:noNamespaceSchemaLocation="courses.xsd">

<course code="BAIT2073"><name>MOBILE APPLICATION DEVELOPMENT</name><desc>&lt;p&gt;Learning the mobile apps &lt;strong&gt;(Kotlin)&lt;/strong&gt;&lt;/p&gt;</desc><CourseMaterials><CourseMaterial id="CM6260259630e997.56338391"><name>BAIT2073 Practical List 202109 </name><link>6260256e25e390.66939264.pdf</link></CourseMaterial></CourseMaterials></course><course code="BAIT2123"><name>Internet of Things</name><desc>&lt;p&gt;Learn the fundamentals knowledge of IoT&lt;/p&gt;</desc><CourseMaterials><CourseMaterial id="CM6260271f74dae4.54707747"><name>LED Fritzing</name><link>6260271f738171.79318369.fzz</link></CourseMaterial></CourseMaterials></course><course code="MPU2030"><name>English</name><desc>&lt;p&gt;Basic english learning&lt;/p&gt;</desc></course><course code="CHI1021"><name>Fundamentals of Chinese</name><desc>&lt;p&gt;Learning the basic knowledge of Chinese language&lt;/p&gt;</desc></course></courses>
